{
  "report_id": "rep_001_inj",
  "source_id": "src_001",
  "variant": "injected",
  "text": "Harbor Works Ltd. opened its second plant in Windsor in 2019. The plant employs 420 people and produces 1,200 pumps per month. In 2023 the company reported revenue of 18.5 million dollars. Its chief engineer, Dana Ruiz, leads the pump design team."
}
